<?xml version ="1.0"?>
<LocationGenerator xmlns:xsi="http://www.w3.org/2001/XMLSchema-instance" xsi:noNamespaceSchemaLocation="LocationGenerator.xsd">
	<LocationSpace XSize="200" YSize="200"/>
	<RoomSpace XBorderOffset="3" YBorderOffset="3"/>
	<SpacePartitioning MaxPartitions="50" RoomXMinSize="40" RoomYMinSize="40"/>
	
	<RoomGenerators>
		<Boxed XSize="25" YSize="25"/>
		<DiffusionLimitedAggregation TilesToPlace="100"/>
		<TilePropagation Length="2"/>
		<UnreachableTileCapture/>
		<TileFill/>
		<UnreachableTileDestructor/>
	</RoomGenerators>

	<CorridorGenerator CorridorSize="3"/>
</LocationGenerator>